text,rating
"Apparently reservations are just a suggestion at this place. Showed up a few minutes before our reservation to be told they had no table for us, and there...",2
Let me start off by saying this is a cute place. Looks clean and homey. Really wanted to love the place. It was pretty busy for a Monday night and seemed...,2
"Came here for a late night bite, but wasn't wild about it. The pizza was not great and the crust didn't taste anything like I'd expect pizza crust to. It...",2
"I was so disappointed with Bar Roma Hostes, my wife best friend from High School was visiting and on Saturday night we decided at the last minute to take...",2
"I have eaten at the River North Gyu-Kaku restaurant and really enjoyed it.  This experience was nothing like it, and extremely horrible. We had a...",1
Absolutely terrible service and the saltiest corn beef sandwich you will ever have!! But the bread was good,1
"Literally the worst place i've ever been to, from the second i step into the door this whole place just emits white privellage & racism.",1
"Ill just let the picture speak for itself.  

Double patty with $2 extra for 5 year aged cheddar (let me know if you can see it cause I couldn't)",1
Poor service and drinks are essentially lipstick on a pig. Staff has poor attitude and prefers to socialize with each other rather than serve customers....,1
"This is not the high French cuisine that pre covid reviews are talking about. 
The chef left and the restaurant increased prices but lowered the quality of...",1
Called on the phone ahead of getting there and was told 15-20min so we came. Arrived at the restaurant at 6:02pm and put our name in and it said 5 parties...,2
"Man, the Weiner Circle really went down hill.  Growing up in Chicago, this was one of the best hot dog stands in the city.  Now, its just all about the...",2
"Let me start by saying, I have been here a hand full of times and the food is always delicious, some times service is hit or miss, but the food is the draw....",2
My husband and I were so excited to try the place due to its great reviews and beautiful location. We made a reservation for 6:30 on a Saturday and were...,2
Utterly disappointing. Location of restaurant right across the street from the Nederlander Threater to see opening night of Moulin Rouge was great. Both...,1
"Innocently walked in and was followed by the door person (a Hispanic woman) back to the bathroom, as I had never been to the bar. Then happened to step...",1
"Went for drinks and dinner last night and ran into a couple of bumps along the ride.

The ambiance and vibe of the place was great but the faults laid in...",2
Very very bad experience.. we order a small size deep dish pizza and it took more then 45mins to get our order. And when we ask what going with our order...,1
"The reason I order from here was to get DJolof rice. iI request a side order of Djolof and for good measure I order Salmon&  Gemjembe.

They literally sent...",1
"First time (likely last time) visit and was sorely disappointed.

For starters the italian beef sandwich was underwhelming, lacked any basic condiments, and...",2
"El taco azteca's staff seems to NOT care about their local customers at all, ignoring order details including food sensitivity/dietary needs/allergies that...",1
I know a lot of people like this place and I am hoping it was an off night.   Was here Two months a go and was excited to be there because came to a number...,1
"Wanted to pick up some sandwiches and big fan of Italian meats
Was very excited to try seeing reviews went in knowing owner is a little grouchy from reviews...",1
"rude owner ...
alwyas late ..
sandwich poor quality...

better choices around...",1
"After being told ""Maybe I am having a bad night"" by a supervisor when waited 15 mins without anyone saying anything to me or given my change after...",2
"Came back to Chicago after a trip to NYC and was unfortunately disappointed by the pizza representation. I ordered the ""Lou"" with a few extra toppings. I am...",2
"Oh man...I hate to give San Soo Gab San such a low rating, but I was SO excited to come here and the food was pretty disappointing in my opinion.

We...",2
"I was really excited to try this restaurant near my friend's neighborhood. We thought it looked a bit pricey, but the reviews seemed great overall.

The...",2
This restaurant has passed its prime.  It is totally dead inside.  Upstairs is shuttered.  Valet parking has been disbanded.  Our favorite waiter has moved...,1
"Placed an online pick-up order this past Monday night. My entree was missing a main ingredient, my side dish had an extra amount of an ingredient I...",2
"First of all
The drinks have like no alcohol. They were being stingy. Then our waiter started flirting with some guy and never came back! I wanted to have a...",2
"I used to work here and the owner is absolutely horrible. First of all, he doesn't pay employees on time, which is one of the main reasons I left. 

Beyond...",1
"In ""hidden gem"" territory for West Loop based on the menu but needs a lot of work. Waiter seemed relatively untrained and skirting the fence between very...",2
"Was craving Italian and needed to find a spot that was in between the north & south so West Loop it was. Free parking in the front.
We had a reservation and...",2
Whoever the bouncer was tonight (4/5/22) wrecked our evening. Lots of attitude and very aggressive. Tried to have a chill night here and he blew it for our...,1
This was my number one but last month I bought fish tacos and there was a small bone (it was not supposed to have bones) it fracture my molar. The owner...,1
"I was supposed to vote 3 star for the low rated food. But the bad customer service encouraged me to give 1 star. 
The salmon was extreme overcooked, it was...",1
